{
	"positionID": 123456789123456,
	"changeDeleteIndicator": "D",
	"positionNumber": 1234567890,
	"positionTitle": "test",
	"occupationCode": "ACODE",
	"areaOfWork": "Around",
	"secondSpeciality": "Spec",
	"deaneryNumber": "NTH/RTFED/040/STR/210",
	"managingOffice": "Northern",
	"odsCode": "CodingCode",
	"gradeTrust": "NTH",
	"gradePayscale": "High",
	"gradeDesc": "Senior",
	"workplaceOrg": "WTO"
}